name,date_published,citation,source,abstract
Cost of major surgery in the sarcopenic patient,2013-11-00,J Am Coll Surg. 2013 Nov&#59;217(5)&#58;813-8. doi&#58; 10.1016/j.jamcollsurg.2013.04.042. Epub 2013 Oct 9.,https://www.ncbi.nlm.nih.gov/pubmed/24119996,"BACKGROUND Sarcopenia is associated with poor outcomes after major surgery. There are currently no data regarding the financial implications of providing care for these high-risk patients. STUDY DESIGN We identified 1,593 patients within the Michigan Surgical Quality Collaborative (MSQC) who underwent elective major general or vascular surgery at a single institution between 2006 and 2011. Patient sarcopenia, determined by lean psoas area (LPA), was derived from preoperative CT scans using validated analytic morphomic methods. Financial data including hospital revenue and direct costs were acquired for each patient through the hospital&#39;s finance department. Financial data were adjusted for patient and procedural factors using multiple linear regression methods, and Mann-Whitney U test was used for significance testing. RESULTS After controlling for patient and procedural factors, decreasing LPA was independently associated with increasing payer costs (&#36;6,989.17 per 1,000 mm(2) LPA, p &#60; 0.001). The influence of LPA on payer costs increased to &#36;26,988.41 per 1,000 mm(2) decrease in LPA (p &#60; 0.001) in patients who experienced a postoperative complication. Further, the covariate-adjusted hospital margin decreased by &#36;2,620 per 1,000 mm(2) decrease in LPA (p &#60; 0.001) such that average negative margins were observed in the third of patients with the smallest LPA. CONCLUSIONS Sarcopenia is associated with high payer costs and negative margins after major surgery. Although postoperative complications are universally expensive to payers and providers, sarcopenic patients represent a uniquely costly patient demographic. Given that sarcopenia may be remediable, efforts to attenuate costs associated with major surgery should focus on targeted preoperative interventions to optimize these high risk patients for surgery."
Can anatomical morphomic variables help predict abdominal injury rates in frontal vehicle crashes&#63;,2013-10-11,Traffic Inj Prev. 2013 Oct 11&#59;15(6)&#58;619-26. doi&#58; 10.1080/15389588.2013.852665.,https://www.ncbi.nlm.nih.gov/pubmed/24867572,"OBJECTIVE Abdominal injuries resulting from vehicle crashes can be significant, in particular when undetected. In this study, abdominal injuries for occupants involved in frontal impacts were assessed using crash and medical data. METHODS Injury rates and patterns were first assessed with respect to thoracic injuries. A statistical analysis was then conducted to predict abdominal injury outcome using 18 covariate variables, including 4 vehicle, 4 demographic, and 10 morphomic, derived from computed tomography (CT) scans. More than 260,000 logistic regression models were fitted using all possible variable combinations. The models were ranked using the Akaike information criterion (AIC) and combined through the model-averaging approach to produce the optimal predictive model. The performance of the models was then assessed using the area under the curve (AUC). RESULTS The rate of serious thoracic injury was 2.49 times higher than the rate of abdominal injury. The associated odds ratio was 2.31 (P &#60;.01). These results suggest a strong association between serious abdominal and thoracic injuries. The optimal model AUC was 0.646 when using solely vehicle data, 0.696 when combining vehicle and demographic data, 0.866 when combining vehicle and morphomic data, and 0.879 when combining vehicle, demographic, and morphomic data. These results suggest that morphomic variables better predict abdominal injury outcomes than demographic variables. The most important morphomics variables included visceral fat area, trabecular bone density, and spine angulation. CONCLUSION This study is the first to combine vehicle, demographic, and anatomical data to predict abdominal injury rates in frontal crashes."
Decreased core muscle size is associated with worse patient survival following esophagectomy for cancer,2013-10-00,Dis Esophagus. 2013 Sep-Oct&#59;26(7)&#58;716-22. doi&#58; 10.1111/dote.12020. Epub 2013 Jan 25.,https://www.ncbi.nlm.nih.gov/pubmed/23350746,"Preoperative risk assessment, particularly for patient frailty, remains largely subjective. This study evaluated the relationship between core muscle size and patient outcomes following esophagectomy for malignancy. Using preoperative computed tomography scans in 230 subjects who had undergone transhiatal esophagectomy for cancer between 2001 and 2010, lean psoas area (LPA), measured at the fourth lumbar vertebra, was determined. Cox proportional hazards regression was employed to analyze overall survival (OS) and disease-free survival (DFS) adjusted for age, gender, and stage, and the Akaike information criterion was used to determine each covariate contribution to OS and DFS. Univariate analysis demonstrated that increasing LPA correlated with both OS (P &#61; 0.017) and DFS (P &#61; 0.038). In multivariate analysis controlling for patient and tumor characteristics, LPA correlated with OS and DFS in patients who had not received neoadjuvant treatment (n &#61; 64), with higher LPA associated with improved OS and DFS. Moreover, LPA was of equivalent, or slightly higher importance than pathologic stage. These measures were not predictive among patients (n &#61; 166) receiving neoadjuvant chemoradiation. Core muscle size appears to be an independent predictor of both OS and DFS, as significant as tumor stage, in patients following transhiatal esophagectomy. Changes in muscle mass related to preoperative treatment may confound this effect. Assessment of core muscle size may provide an additional objective measure for risk stratification prior to undergoing esophagectomy."
Temporal morphomics as a model for determining preoperative risk of blood transfusion in non-syndromic craniosynostasis patients,2013-09-00,Plast Reconstr Surg. 2013 Sep&#59;132(3)&#58;403e-12e. doi&#58; 10.1097/PRS.0b013e31829ad31f.,https://www.ncbi.nlm.nih.gov/pubmed/23985652,"BACKGROUND Estimates of blood loss during craniosynostosis surgeries have ranged from 42 to 126 percent of infant&#39;s total blood volume. Currently, no risk model has been developed to determine the likelihood of needing a blood transfusion. The authors propose an objective model, based on patients&#39; three-dimensional anatomical characteristics, to stratify the likelihood of needing perioperative packed red blood cells. METHODS High-throughput image analysis from already ordered preoperative computed tomographic scans was used to reconstruct the three-dimensional anatomy of the temporalis muscle and overlying temporal fat pad. Using these morphomic measurements, the authors created a risk assessment model of the amount of packed red blood cells infused based on morphomic variations in temporal soft tissue. RESULTS The authors evaluated 139 infants with nonsyndromic craniosynostosis from the University of Michigan Health System. Results show the need for blood transfusion ranged from 94.1 percent among patients in the smallest quartile for temporal fat pad volume compared with 65.7 percent among the group with the largest quartile for temporal fat pad volume (p &#61; 0.0057). Using multivariable linear regression, temporal fat pad volume (p &#61; 0.012) and fat pad thickness (p &#61; 0.036) were independent predictors for amount of packed red blood cells required. CONCLUSIONS The authors demonstrate that patients with diminished temporal fat pad volume are significantly more likely to need increased packed red blood cell transfusions. In addition, by use of multivariable linear regression, their data suggest that temporal fat pad volume and thickness were independent predictors for the amount of required transfusion of packed red blood cells."
Analytic morphometric assessment of patients undergoing colectomy for colon cancer,2013-09-00,J Surg Oncol. 2013 Sep&#59;108(3)&#58;169-75. doi&#58; 10.1002/jso.23366. Epub 2013 Jul 11.,https://www.ncbi.nlm.nih.gov/pubmed/23846976,"BACKGROUND Analytic morphometrics provides objective data that may better stratify risk. We investigated morphometrics and outcome among colon cancer patients. METHODS An IRB-approved review identified 302 patients undergoing colectomy who had CT scans. These were processed to measure psoas area (PA), density (PD), subcutaneous fat (SFD), visceral fat (VF), and total body fat (TBF). Correlation with complications, recurrence, and survival were obtained by t-tests and linear regression models after adjusting for age and Charlson index. RESULTS The best predictor of surgical complications was PD. PMH, Charlson, BMI, and age were not significant when PD was considered. SF area was the single best predictor of a wound infection. While all measures of obesity correlated with outcome, TBF was most predictive. Final multivariate Cox models for survival included age, Charlson score, nodal positivity, and TBF. CONCLUSIONS Analytic morphometric analysis provided objective data that stratified complications and outcome better than age, BMI, or co-morbidities."
Analysis of Morphomics Parameters by Gender and BMI Groups&#58; thorax shape and H-point location.,2013-09-00,International Research Council on Biomechanics of Injury. 2013 Sep. Session S4-4 - Accident Analysis 2&#58; IRC-13-81.,http://www.ircobi.org/wordpress/downloads/irc13/pdf_files/81.pdf,"The automotive safety community is questioning the effect of obesity on the performance and assessment of occupant protection systems. This study analyzed CT scan measurements of 10,952 individuals older than 15 years by Body Mass Index (BMI) and gender, including the H‐point location defined relative longitudinal distance between the centroid of the femoral head and the most posterior skin measurement, vertebra‐to‐front‐skin distance, and spine‐to‐back‐skin distance along the sagittal plane. The distance data was obtained at each vertebra level.The average H‐point location increased with BMI and varied with gender. A regression analysis was fitted on the data. For females, it was equal to 55.90 &#43;2.47&#42;BMI in the normal size group, 86.25&#43;1.30&#42;BMI in the obese group, and 116.25&#43;0.55&#42;BMI mm in the morbidly obese group (p&#60;0.01). For males the corresponding H‐point was 64.12&#43;2.11&#42;BMI, 77.28&#43;1.62&#42;BMI, and 95.13&#43;1.17&#42;BMI mm (p&#60;0.01). The vertebra‐to‐front skin and spine‐ to‐back skin distances also increased with BMI and differed with gender. With the increasing worldwide concern for obese occupant protection, test devices representative of this segment of the population are necessary. Human math models provide the best option for a parametric analysis of protection systems designed and optimized for various BMI and gender groups. The morphomic data was analyzed to represent a 5<sup>th</sup> percentile female and 50<sup>th</sup> percentile male dummy. These results will be useful in the modifications of the current human mathematical models to represent obese occupants."
Restrained Male and Female Occupants in Frontal Crashes: Are We Different?,2013-09-00,International Research Council on Biomechanics of Injury. 2013 Sep. Session S6-1 - Frontal Impacts&#58; IRC-13-98.,http://www.ircobi.org/wordpress/downloads/irc13/pdf_files/98.pdf,"The safety community is questioning the effect of gender on the performance and assessment of occupant protection systems. This study consists of&#58; 1) an investigation of NASS‐CDS data with belted occupants involved in frontal vehicle crashes and 2) a comparison of dummy responses in two matched frontal tests. Because of recent work on a 50<sup>th</sup> female dummy neck, focus was placed on neck responses. An assessment of cervical facet angles was also carried out from computed tomography (CT) scans of 423 adult patients.The NASS‐CDS data showed that the relative risk of being seriously injured was higher in females than in males for crash severities up to 65 km/h. Females had higher overall risks of serious injury in all body regions except for the head and the abdomen. In 25 to 65 km/h crashes, females were more at risk of spine injuries than males. In the matched tests, the normalized results showed overall higher biomechanical responses in the female than in the male dummy, in particular in the neck region. Airbag interaction with the head/neck complex was noted with the female dummy. The CT scan data indicated that the cervical facet angles increased with age, becoming more horizontal. The increase was greater in females than in males. The quantification of anatomical changes associated with gender is needed to improve physical and/or numerical tools used to assess occupant responses and to understand differences in injury patterns."
Morphomic Measurement of the Temporalis Muscle and Zygomatic Bone as Novel Predictors of Hospital-Based Clinical Outcomes in Patients with Mandible Fracture,2013-09-00,J Craniofac Surg. 2013 Sep&#59;24(5)&#58;1577-81. doi&#58; 10.1097/SCS.0b013e3182a12e02.,https://www.ncbi.nlm.nih.gov/pubmed/24036730,"INTRODUCTION Patients with mandibular fracture often have comorbidities and concomitant injuries making the decision for when and how to operate a challenge. Physicians describe &#34;temporalis wasting&#34; as a finding that indicates frailty&#59; however, this is a subjective finding without quantitative values. In this study, we demonstrate that decreased morphomic values of the temporalis muscle and zygomatic bone are an objective measure of frailty associated with increased injury-induced morbidity as well as negative impact on overall hospital-based clinical outcomes in patients with mandible fracture. METHODS Computed tomographic (CT) scans from all patients with a diagnosis of a mandible fracture in the University of Michigan trauma registry and with a hospital admission were collected from the years 2004 to 2011. Automated, high-throughput CT analysis was used to reconstruct the anatomy and quantify morphomic values (temporalis volume, area and thickness, and zygomatic thickness) in these patients using MATLAB v13.0 (MathWorks Inc, Natick, MA, USA). Subsequently, a subset of 16 individuals with a Glasgow Coma Scale of 14 or 15 was analyzed to control for brain injury. Clinical data were obtained, and the association between morphomic measurements and clinical outcomes was evaluated using Pearson correlation for unadjusted analysis and multiple regression for adjusted analysis. RESULTS The mean age of patients in the study was 47.1 years. Unadjusted analysis using Pearson correlation revealed that decreases in zygomatic bone thickness correlated strongly with increases in hospital, intensive care unit, and ventilator days (P &#60; 0.0001, P &#61; 0.0003, and P &#60; 0.0017, respectively). Furthermore, we found that decreases in temporalis mean thickness correlated with increases in hospital and ventilator days (P &#61; 0.0264 and P &#61; 0.0306, respectively). Similarly, decreases in temporalis local mean thickness are significantly correlated with increases in hospital and ventilator days (P &#61; 0.0232 and P &#61; 0.0472, respectively). CONCLUSIONS Decreased thicknesses of the zygomatic bone and temporalis muscle are significantly correlated with higher hospital, ventilator, and intensive care unit days in patients with mandibular fracture receiving reconstructive operations. This morphomic methodology provides an accurate, quantitative means to evaluate craniofacial trauma patient frailty, injury, and outcomes using routinely obtained CT scans. In the future, we plan to apply this approach to determine preoperative risk stratification and assist in surgical planning."
"Variation in the femoral bow&#58; a novel high-throughput analysis of 3,922 femurs on cross-sectional imaging",2013-06-11,J Orthop Trauma. 2013 June 11&#59;28(1)&#58;6-9. doi&#58; 10.1097/BOT.0b013e31829ff3c9.,https://www.ncbi.nlm.nih.gov/pubmed/23799352,"OBJECTIVES To evaluate femoral radius of curvature in a large sample of computed tomography scans to definitively determine the relationship between radius of curvature and femoral length, age, gender, ethnicity, body mass index and cortical thickness. METHODS A retrospective review was conducted of the electronic medical records and advanced imaging of 1961 patients who underwent pulmonary embolism protocol computed tomography scans between December 1999 and March 2010. The computed tomography scans were imported from the clinical picture archiving and communication system archive into a research image archive and analysis system. Each scan was processed by an automated system that algorithmically determined bony landmarks, adjusted for body position within the scanner and measured the radius of curvature. RESULTS The mean medullary radius of curvature of 3922 femurs was 112 cm (SD &#61; 26 cm). The mean anterior radius of curvature of the femurs was 145 cm (SD &#61; 55 cm). There was a moderately strong positive correlation (0.36-0.39) between femoral length and radius of curvature (P &#60; 0.0001) that was not affected by age, body mass index, cortical thickness, gender, or ethnicity. No significant relationship was found between either gender or ethnicity and radius of curvature independent of femoral length. CONCLUSIONS Differences in radius of curvature based on ethnicity and gender exist primarily because of the variation in average height, and therefore femur length, that exists between ethnic groups and genders. These data may prove useful in the design of safer intramedullary implants that accommodate a greater spectrum of anatomic variation."
Age-Based Predictive Model of the Pediatric Ribcage,2013-05-23,International Journal of Automotive Engineering. 2013 May 23. Vol. 5 (2014) No. 1 p. 15-22,https://www.jstage.jst.go.jp/article/jsaeijae/5/1/5_20144186/_pdf,"Ribcage geometry of 327 boys and girls (aged 1-18) was extracted from CT scans, consisting of three dimensional curves fit through the centroidal path of 6306 individual ribs. Each rib was characterized by 7 parameters describing a rib&#39;s in-plane geometry, 2 describing its out-of-plane deviation, and 3 describing the rib orientation relative to anatomical planes. Parameters were predicted by age and gender to fully describe variation in size and shape of rib centroidal geometry as a continuous function following growth throughout childhood. A demographics-based model was also presented describing average ribcage geometry for children of any given age, weight, and height."
Novel application of human morphomics to quantify temporal soft tisues in Pierre Robin and Treacher Collins,2012-06-07,J Craniofac Surg. 2012 June 7&#59;24(1)&#58;158-62. doi&#58; 10.1097/SCS.0b013e3182646411.,https://www.ncbi.nlm.nih.gov/pubmed/23348276,"INTRODUCTION Pierre Robin sequence (PR) and Treacher Collins syndrome (TC) are congenital disorders associated with multiple craniofacial abnormalities. The mandibular malformations linked with these maladies are closely associated with the form and function of the temporalis muscle. Despite these associations, a paucity of research has been directed at quantifying how these malformations affect the tissues of the temporal region. In this paper, we seek to quantify differences in the temporalis muscle and the temporal fat pad using a novel CT-derived analytic program to examine craniofacial morphomic indices within these patient groups in comparison to normal age-matched controls. We posit that the temporalis muscle and temporal fat pad, like other derivatives of the first branchial arch, are hypoplastic in patients with TC and PR compared to age-matched controls. METHODS High-throughput image analysis was used to reconstruct the 3-dimensional (3D) anatomy and quantify morphomic measures of the temporalis muscle and temporal fat pad in children with PR, TC, and age-matched controls. These steps were completed in a semi-automated method using algorithms programmed in MATLAB v13.0. The 3D reconstructions were analyzed in 3 children with PR (6 temporal regions), 3 children with TC (6 temporal regions), and a control group of 19 children (38 temporal regions). We also quantified the same measurements in a localized &#34;core&#34; sample in the area of greatest thickness, providing a more consistent sample of the tissue position. Relationships between the temporal muscle and fat pad values and craniofacial abnormality type were assessed using Wilcoxon nonparametric test using exact distribution, with a P value of less than 0.05 being deemed significant. RESULTS The mean age of our patients was 6.0 years in PR and 4.5 years in TC cohorts. We were able to establish an automated methodology to quantify the temporalis muscle and temporal fat pad based on CT characteristics. Localized temporalis volume and localized temporalis area were significantly smaller in children with PR than in the control group. Total temporalis fat volume and localized temporalis area were significantly less in children with TC than in the control group. When compared to each other, the PR group had small morphomic values compared to TC group. CONCLUSIONS There are significant morphomic differences in the temporalis muscle and the temporal fat pad in children with either PR or TC when compared to age-matched control group which can be measured from pre-existing CT scans. Specifically, both of these test groups show decreases in the morphomic measures of the temporalis region. The quantification of these changes corroborates and objectifies the clinical findings associated with these congenital deformities while simultaneously allowing for preoperative planning. Furthermore, this finding confirms that the hypoplasia seen in these patient populations is not only hypoplasia of the mandible but also of the surrounding functional matrix, which includes the temporalis muscle and temporal fat pad."
The effect of age on fat and bone properties along the vertebral spine,2013-00-00,"SAE Int. J. Trans. Safety 1(2)&#58;226-240, 2013, doi&#58;10.4271/2013-01-1244.",https://saemobilus.sae.org/content/2013-01-1244,"The human body changes as it becomes older. The automotive safety community has been interested in understanding the effect of aging on restraint performance. Recent research has been focused on assessing the structural and material changes associated with age. In this study, structural tissue distribution was determined using the computed tomography (CT) scan data of more than 19,000 patients, aged 16 and up. The data consisted of subcutaneous fat cross-sectional area, visceral fat cross-sectional area, and trabecular bone density taken at each vertebral level. The data was quantified as a function of five age groups with the youngest group defined as 16-29 years old and the oldest group as 75 and up. An additional analysis stratified on gender was carried out. Overall, visceral fat increased with age. Compared to the 16-29 group, the visceral fat measured at the L1 level was 1.97 in the 30-44 group, 2.55 in the 45-59 group, 3.33 in the 60-74 group and 3.21 times greater in the 75&#43; group. Subcutaneous fat also increased with age up to the 60-74-year-old group. The subcutaneous fat measured at L1 level was 1.34 in the 30-44 group, 1.39 in the 45-59 group, 1.38 in the 60-74 group and 1.09 times greater in the 75&#43; group than in the 16-29 group. A significant association between trabecular bone density and age was found. Trabecular bone density in Hounsfield units (HU) decreased as a function of age, by 2.57&#42;age &#43;0.0056&#42;age<sub>2</sub> for females and 2.57&#42;age &#43;0.0082&#42;age<sub>2</sub> for males. Gender differences were also observed. Females had 1.43 times more subcutaneous fat and 1.10 times higher trabecular bone density than males at L1, while males had 1.88 times more visceral fat than females. Females gained more subcutaneous fat at L1 as they increased in age up to the 45-59 group and then progressively lost subcutaneous fat. Males and females gained more visceral fat at L1 as they aged up to the 60-74 group. Both consistently lost bone density at L1 as they grew older. The data was also analyzed for a male subgroup approximating the height and weight of a 50<sup>th</sup> percentile male dummy. Visceral fat increased with age while trabecular bone density decreased. There was an overall-trend for an increase in subcutaneous fat with age. The results obtained in this study provide insight on the quantified effect of bone and fat distribution as a function of age, gender, and vertebral level. Fat and bone distribution needs to be considered in human mathematical models used to develop safety countermeasures for the older population."
